{
  "caseId": "norm-background-jobs-03",
  "clarificationGoldVersion": "retrieval-clarification-gold/1.0.0",
  "clarificationRequired": true,
  "clarifications": [
    {
      "possibleConceptIds": [
        "delayed-jobs"
      ],
      "reasonCode": "constraint-modality-conflict",
      "sourceIds": [
        "norm-background-jobs-03-constraint-3303",
        "norm-background-jobs-03-constraint-9654"
      ]
    }
  ],
  "provenance": {
    "reviewReference": null,
    "reviewStatus": "not-reviewed",
    "reviewedAt": null,
    "reviewer": null,
    "status": "proposed"
  },
  "terminalUnsupported": false
}
