{
  "caseId": "norm-audit-logging-01",
  "clarificationGoldVersion": "retrieval-clarification-gold/1.0.0",
  "clarificationRequired": false,
  "clarifications": [],
  "provenance": {
    "reviewReference": null,
    "reviewStatus": "not-reviewed",
    "reviewedAt": null,
    "reviewer": null,
    "status": "proposed"
  },
  "terminalUnsupported": false
}
