{
  "caseId": "norm-authorization-04",
  "clarificationGoldVersion": "retrieval-clarification-gold/1.0.0",
  "clarificationRequired": true,
  "clarifications": [
    {
      "possibleConceptIds": [],
      "reasonCode": "subjective-term",
      "sourceIds": [
        "norm-authorization-04-term-02"
      ]
    }
  ],
  "provenance": {
    "reviewReference": null,
    "reviewStatus": "not-reviewed",
    "reviewedAt": null,
    "reviewer": null,
    "status": "proposed"
  },
  "terminalUnsupported": false
}
