{
  "caseId": "norm-audit-logging-02",
  "clarificationGoldVersion": "retrieval-clarification-gold/1.0.0",
  "clarificationRequired": true,
  "clarifications": [
    {
      "possibleConceptIds": [
        "audit-logging",
        "structured-audit-events"
      ],
      "reasonCode": "capability-scope-ambiguous",
      "sourceIds": [
        "norm-audit-logging-02-term-01"
      ]
    },
    {
      "possibleConceptIds": [],
      "reasonCode": "primary-family-not-established",
      "sourceIds": [
        "norm-audit-logging-02-term-01"
      ]
    }
  ],
  "provenance": {
    "reviewReference": null,
    "reviewStatus": "not-reviewed",
    "reviewedAt": null,
    "reviewer": null,
    "status": "proposed"
  },
  "terminalUnsupported": false
}
